{
    "$schema": "https://json-schema.org/draft/2020-12/schema",
    "$id": "https://github.com/qgis-deployment/qgis-deployment-toolbelt-cli/raw/main/docs/schemas/profile/qgis_profile.json",
    "$comment": "A QGIS profile described in a JSON file in the QDT formalism.",
    "type": "object",
    "properties": {
        "alias": {
            "description": "Profile's name in an human readable form, allowing special characters.",
            "type": "string"
        },
        "author": {
            "description": "Name of profile author and maintainer.",
            "type": "string"
        },
        "description": {
            "description": "Profile description.",
            "type": "string"
        },
        "email": {
            "description": "Email of profile's author and maintainer.",
            "format": "email",
            "maxLength": 127,
            "minLength": 6,
            "type": "string"
        },
        "folder_name": {
            "description": "Name of the profile's directory in QGIS.",
            "type": "string"
        },
        "icon": {
            "description": "Relative path to the icon used for shortcuts.",
            "type": "string"
        },
        "name": {
            "description": "Profile name without any special characters.",
            "type": "string"
        },
        "qdtMinVersion": {
            "description": "Minimum version of QGIS Deployment Toolbelt required to deploy this profile. Must follow Semver. If the running QDT version is older, the profile is not deployed.",
            "type": "string",
            "pattern": "^[0-9]+\\.[0-9]+\\.[0-9]+$",
            "examples": [
                "0.45.0"
            ]
        },
        "plugins": {
            "description": "Plugins installed with the profile.",
            "title": "QGIS Plugins",
            "type": "array",
            "items": {
                "$ref": "qgis_plugin.json"
            }
        },
        "qgisMaximumVersion": {
            "description": "Maximum QGIS version where the profile can be deployed. It should complies with SemVer.",
            "maxLength": 14,
            "minLength": 5,
            "pattern": "^(?:0|[1-9]\\d*)\\.(?:0|[1-9]\\d*)\\.(?:0|[1-9]\\d*)$",
            "type": "string"
        },
        "qgisMinimumVersion": {
            "description": "Minimum QGIS version where the profile can be deployed. It should complies with SemVer.",
            "maxLength": 14,
            "minLength": 5,
            "pattern": "^(?:0|[1-9]\\d*)\\.(?:0|[1-9]\\d*)\\.(?:0|[1-9]\\d*)$",
            "type": "string"
        },
        "rules": {
            "description": "Logical rules based on contextual elements that condition profile deployment.",
            "title": "QGIS Plugins",
            "type": "array",
            "items": {
                "$ref": "rules.json"
            }
        },
        "splash": {
            "description": "Relative path to the splash image.",
            "type": "string"
        },
        "version": {
            "description": "Profile version. Must complies with SemVer.",
            "maxLength": 14,
            "minLength": 5,
            "pattern": "^(?:0|[1-9]\\d*)\\.(?:0|[1-9]\\d*)\\.(?:0|[1-9]\\d*)$",
            "type": "string"
        }
    },
    "required": [
        "author",
        "email",
        "name",
        "version"
    ]
}
