{
  "$schema": "https://raw.githubusercontent.com/qgis-deployment/qgis-deployment-toolbelt-cli/main/docs/schemas/profile/qgis_profile.json",
  "name": "QDT Only Linux",
  "folder_name": "qdt_only_linux",
  "description": "Demonstrating a QDT profile that's deployed only on Linux.",
  "author": "Julien Moura",
  "email": "infos+qdt@oslandia.com",
  "qdtMinVersion": "0.41.0",
  "qgisMinimumVersion": "3.34.0",
  "qgisMaximumVersion": "4.10.10",
  "version": "1.0.0",
  "rules": [
    {
      "name": "Environment",
      "description": "Profile is configured to run only on Linux.",
      "conditions": {
        "all": [
          {
            "path": "$.environment.operating_system_code",
            "value": "linux",
            "operator": "equal"
          },
          {
            "path": "$.date.current_year",
            "value": 2023,
            "operator": "greater_than_inclusive"
          }
        ]
      }
    }
  ]
}
