{
  "$schema": "https://raw.githubusercontent.com/qgis-deployment/qgis-deployment-toolbelt-cli/main/docs/schemas/profile/qgis_profile.json",
  "name": "QDT Viewer Mode",
  "folder_name": "qdt_viewer_mode",
  "description": "Demo QGIS profile for QDT customized for end-users which are only viewers.",
  "author": "Julien Moura",
  "email": "infos+qdt@oslandia.com",
  "icon": "images/icon_shortcut_qdt_viewer_mode.ico",
  "qdtMinVersion": "0.35.0",
  "qgisMinimumVersion": "3.34.4",
  "qgisMaximumVersion": "4.99.15",
  "version": "1.1.2",
  "plugins": [
    {
      "name": "Layers menu from project",
      "folder_name": "menu_from_project",
      "official_repository": true,
      "plugin_id": 43,
      "version": "2.4.4"
    },
    {
      "name": "qNote",
      "folder_name": "qNote",
      "official_repository": true,
      "plugin_id": 122,
      "version": "2.3"
    },
    {
      "name": "QuickMapServices",
      "folder_name": "quick_map_services",
      "official_repository": true,
      "plugin_id": 666,
      "version": "0.19.33"
    },
    {
      "name": "QuickOSM",
      "folder_name": "QuickOSM",
      "official_repository": true,
      "plugin_id": 579,
      "upgrade_mode": "keep",
      "version": "2.2.3"
    },
    {
      "name": "Red Layer",
      "folder_name": "redLayer",
      "official_repository": true,
      "plugin_id": 752,
      "upgrade_mode": "delete",
      "version": "2.2"
    },
    {
      "name": "Spreadsheet Layers",
      "folder_name": "SpreadsheetLayers",
      "official_repository": true,
      "plugin_id": 766,
      "version": "2.1.0"
    }
  ]
}
